"Status","Start Time","Stop Time","Duration in ms","Parent Suite","Suite","Sub Suite","Test Class","Test Method","Name","Description"
"passed","Tue Nov 24 08:37:39 GMT 2020","Tue Nov 24 08:37:56 GMT 2020","16498","","request-history-filtering-by-date @request-history-filtering-by-date","","request-history-filtering-by-date @request-history-filtering-by-date","I can filter the request log using the time interval {""timeInterval"":""1 Hour"",""datetimeFrom"":""1"",""datetimeTo"":""current time""} @functional @smoke @TEST-167 @success","I can filter the request log using the time interval {""timeInterval"":""1 Hour"",""datetimeFrom"":""1"",""datetimeTo"":""current time""} @functional @smoke @TEST-167 @success",""
"failed","Tue Nov 24 08:38:04 GMT 2020","Tue Nov 24 08:38:14 GMT 2020","10795","","dashboard-requests-filtering-by-file-risk @dashboard-requests-filtering-by-file-risk","","dashboard-requests-filtering-by-file-risk @dashboard-requests-filtering-by-file-risk","I can filter the risk legend {""chart"":""pie"",""fileRisk"":""Blocked By NCFS"",""filteredRisk"":""Blocked By NCFS""} @smoke @TEST-192 @Fail-App","I can filter the risk legend {""chart"":""pie"",""fileRisk"":""Blocked By NCFS"",""filteredRisk"":""Blocked By NCFS""} @smoke @TEST-192 @Fail-App",""
"passed","Tue Nov 24 08:40:48 GMT 2020","Tue Nov 24 08:41:27 GMT 2020","39097","","Content Management Policy Editing @content-management-policy-editing","","Content Management Policy Editing @content-management-policy-editing","A user is able to change all content flags for all file type in policy page {""FileType"":""pdf"",""FlagType"":""disallow""} @success @functional @smoke @TEST-215","A user is able to change all content flags for all file type in policy page {""FileType"":""pdf"",""FlagType"":""disallow""} @success @functional @smoke @TEST-215",""
"failed","Tue Nov 24 08:38:04 GMT 2020","Tue Nov 24 08:38:15 GMT 2020","10935","","user-records-admin @user-records-admin","","user-records-admin @user-records-admin","I can delete another user from the page {""name"":""tester2"",""email"":""tester2@glasswalltest.co""} @smoke @TEST-172 @Fail-app","I can delete another user from the page {""name"":""tester2"",""email"":""tester2@glasswalltest.co""} @smoke @TEST-172 @Fail-app",""
"passed","Tue Nov 24 08:39:08 GMT 2020","Tue Nov 24 08:39:22 GMT 2020","13120","","non-compliant-files-routing-mechanism @non-compliant-files-routing-mechanism","","non-compliant-files-routing-mechanism @non-compliant-files-routing-mechanism","I can change the outcome of Glasswall Blocked files {""routeOption"":""Relay"",""updatedRouteOption"":""Relay""} @success @smoke @TEST-187","I can change the outcome of Glasswall Blocked files {""routeOption"":""Relay"",""updatedRouteOption"":""Relay""} @success @smoke @TEST-187",""
"failed","Tue Nov 24 08:38:25 GMT 2020","Tue Nov 24 08:38:36 GMT 2020","10791","","dashboard-requests-filtering-by-file-risk @dashboard-requests-filtering-by-file-risk","","dashboard-requests-filtering-by-file-risk @dashboard-requests-filtering-by-file-risk","I can filter the risk legend {""chart"":""pie"",""fileRisk"":""Allowed By Policy"",""filteredRisk"":""Allowed By Policy""} @smoke @TEST-192 @Fail-App","I can filter the risk legend {""chart"":""pie"",""fileRisk"":""Allowed By Policy"",""filteredRisk"":""Allowed By Policy""} @smoke @TEST-192 @Fail-App",""
"failed","Tue Nov 24 08:37:39 GMT 2020","Tue Nov 24 08:37:51 GMT 2020","11730","","dashboard-requests-metrics-display @dashboard-requests-metrics-display","","dashboard-requests-metrics-display @dashboard-requests-metrics-display","The file risk count is updated for every file processed based on the outcome {""risk"":""Safe"",""file"":""safe_file.xlsx"",""increasedValue"":""1""} @smoke @TEST-223 @Fail-Code","The file risk count is updated for every file processed based on the outcome {""risk"":""Safe"",""file"":""safe_file.xlsx"",""increasedValue"":""1""} @smoke @TEST-223 @Fail-Code",""
"failed","Tue Nov 24 08:38:26 GMT 2020","Tue Nov 24 08:38:37 GMT 2020","10872","","file-drop-file-processing @file-drop-file-processing","","file-drop-file-processing @file-drop-file-processing","I can process a file through the file drop service {""supportedFile"":""src/data/input/structuralIssues.xlsx"",""fileName"":""structuralIssues.xlsx"",""fileType"":""xlsx"",""processStatus"":""Your file has been processed""} @success @smoke @TEST-230","I can process a file through the file drop service {""supportedFile"":""src/data/input/structuralIssues.xlsx"",""fileName"":""structuralIssues.xlsx"",""fileType"":""xlsx"",""processStatus"":""Your file has been processed""} @success @smoke @TEST-230",""
"passed","Tue Nov 24 08:39:12 GMT 2020","Tue Nov 24 08:39:46 GMT 2020","34424","","user-session-admin @user-session-admin","","user-session-admin @user-session-admin","I am able to update my password {""CurrentPassword"":""OldPassword1?"",""NewPassword"":""NewPassword2)"",""ConfirmNewPassword"":""NewPassword2)""} @success @smoke @TEST-","I am able to update my password {""CurrentPassword"":""OldPassword1?"",""NewPassword"":""NewPassword2)"",""ConfirmNewPassword"":""NewPassword2)""} @success @smoke @TEST-",""
"passed","Tue Nov 24 08:37:58 GMT 2020","Tue Nov 24 08:38:14 GMT 2020","16016","","non-compliant-files-routing-mechanism @non-compliant-files-routing-mechanism","","non-compliant-files-routing-mechanism @non-compliant-files-routing-mechanism","I can only update the non-compliant routes API URL with a valid one {""url"":""glasswallsolutions.com"",""message"":""success""} @smoke @TEST-158_159 @Fail-app","I can only update the non-compliant routes API URL with a valid one {""url"":""glasswallsolutions.com"",""message"":""success""} @smoke @TEST-158_159 @Fail-app",""
"failed","Tue Nov 24 08:38:26 GMT 2020","Tue Nov 24 08:38:37 GMT 2020","10852","","dashboard-requests-metrics-display @dashboard-requests-metrics-display","","dashboard-requests-metrics-display @dashboard-requests-metrics-display","The count of files requests processed is updated based on processing status {""file"":""blocked_file.doc"",""fileOutcome"":""Blocked By Policy"",""TFUpdateByValue"":""0"",""TRUpdateByValue"":""1"",""MFUpdateByValue"":""0""} @smoke @TEST-224","The count of files requests processed is updated based on processing status {""file"":""blocked_file.doc"",""fileOutcome"":""Blocked By Policy"",""TFUpdateByValue"":""0"",""TRUpdateByValue"":""1"",""MFUpdateByValue"":""0""} @smoke @TEST-224",""
"passed","Tue Nov 24 08:38:27 GMT 2020","Tue Nov 24 08:38:54 GMT 2020","26728","","request-history-filtering-by-file-type @request-history-filtering-by-file-type","","request-history-filtering-by-file-type @request-history-filtering-by-file-type","filter the log by file type {""filter"":""docx"",""filteredFile"":""Docx""} @success @functional @smoke @TEST-163","filter the log by file type {""filter"":""docx"",""filteredFile"":""Docx""} @success @functional @smoke @TEST-163",""
"failed","Tue Nov 24 08:38:15 GMT 2020","Tue Nov 24 08:38:26 GMT 2020","10882","","file-drop-file-processing @file-drop-file-processing","","file-drop-file-processing @file-drop-file-processing","I can process a file through the file drop service {""supportedFile"":""src/data/input/issues.docx"",""fileName"":""issues.docx"",""fileType"":""docx"",""processStatus"":""Your file has been processed""} @success @smoke @TEST-230","I can process a file through the file drop service {""supportedFile"":""src/data/input/issues.docx"",""fileName"":""issues.docx"",""fileType"":""docx"",""processStatus"":""Your file has been processed""} @success @smoke @TEST-230",""
"failed","Tue Nov 24 08:39:10 GMT 2020","Tue Nov 24 08:39:20 GMT 2020","10220","","file-drop-file-analysis-reporting @file-drop-file-analysis-reporting","","file-drop-file-analysis-reporting @file-drop-file-analysis-reporting","I can download the full PDF analysis report for a file {""supportedFile"":""src/data/input/file2.pdf"",""pdfFile"":""file2.pdf""} @smoke @TEST-226 @Fail-code","I can download the full PDF analysis report for a file {""supportedFile"":""src/data/input/file2.pdf"",""pdfFile"":""file2.pdf""} @smoke @TEST-226 @Fail-code",""
"failed","Tue Nov 24 08:39:30 GMT 2020","Tue Nov 24 08:39:41 GMT 2020","10906","","dashboard-requests-filtering-by-process-date @dashboard-requests-filtering-by-process-date","","dashboard-requests-filtering-by-process-date @dashboard-requests-filtering-by-process-date","I am able to filter the dashboard requests by time {""time"":""Custom Range"",""dateStart"":""2/10/2020 10:30 AM"",""dateEnd"":""2/10/2020 11:00 AM"",""dateRange"":""02/10/2020 10:30 AM - 02/10/2020 11:00 AM""} @success @smoke @TEST-151_custom","I am able to filter the dashboard requests by time {""time"":""Custom Range"",""dateStart"":""2/10/2020 10:30 AM"",""dateEnd"":""2/10/2020 11:00 AM"",""dateRange"":""02/10/2020 10:30 AM - 02/10/2020 11:00 AM""} @success @smoke @TEST-151_custom",""
"failed","Tue Nov 24 08:37:39 GMT 2020","Tue Nov 24 08:37:51 GMT 2020","11441","","dashboard-requests-filtering-by-file-risk @dashboard-requests-filtering-by-file-risk","","dashboard-requests-filtering-by-file-risk @dashboard-requests-filtering-by-file-risk","I can filter the risk legend {""chart"":""pie"",""fileRisk"":""Safe"",""filteredRisk"":""Safe""} @smoke @TEST-192 @Fail-App","I can filter the risk legend {""chart"":""pie"",""fileRisk"":""Safe"",""filteredRisk"":""Safe""} @smoke @TEST-192 @Fail-App",""
"passed","Tue Nov 24 08:39:24 GMT 2020","Tue Nov 24 08:39:46 GMT 2020","22192","","Content Management Policy Editing @content-management-policy-editing","","Content Management Policy Editing @content-management-policy-editing","I can edit policy content flags {""FileType"":""word"",""ContentFlags"":""embeddedFiles"",""FlagType"":""sanitise""} @success @functional @smoke @TEST-214","I can edit policy content flags {""FileType"":""word"",""ContentFlags"":""embeddedFiles"",""FlagType"":""sanitise""} @success @functional @smoke @TEST-214",""
"failed","Tue Nov 24 08:38:15 GMT 2020","Tue Nov 24 08:38:26 GMT 2020","10883","","user-records-admin @user-records-admin","","user-records-admin @user-records-admin","A new user cannot be added with a invalid email {""name"":""InvalidUser1"",""email"":""Invalid@email.com""} @smoke @TEST-185 @Fail-app","A new user cannot be added with a invalid email {""name"":""InvalidUser1"",""email"":""Invalid@email.com""} @smoke @TEST-185 @Fail-app",""
"passed","Tue Nov 24 08:37:39 GMT 2020","Tue Nov 24 08:37:58 GMT 2020","18180","","non-compliant-files-routing-mechanism @non-compliant-files-routing-mechanism","","non-compliant-files-routing-mechanism @non-compliant-files-routing-mechanism","The default routing option for unprocessable and blocked files is accurate @success @smoke @TEST-MISSING","The default routing option for unprocessable and blocked files is accurate @success @smoke @TEST-MISSING",""
"failed","Tue Nov 24 08:37:53 GMT 2020","Tue Nov 24 08:38:04 GMT 2020","11051","","file-drop-file-process-result-view @file-drop-file-process-result-view","","file-drop-file-process-result-view @file-drop-file-process-result-view","I can see the result of a repaired file with the issues removed {""activeContentFile"":""src/data/input/file1.docx"",""activeContent"":""Internal Hyperlinks present in CT_Bookmark"",""repairedObject"":""APP segment removed"",""processStatus"":""Your file has been processed""} @success @smoke @TEST-228","I can see the result of a repaired file with the issues removed {""activeContentFile"":""src/data/input/file1.docx"",""activeContent"":""Internal Hyperlinks present in CT_Bookmark"",""repairedObject"":""APP segment removed"",""processStatus"":""Your file has been processed""} @success @smoke @TEST-228",""
"failed","Tue Nov 24 08:39:41 GMT 2020","Tue Nov 24 08:39:52 GMT 2020","10903","","dashboard-requests-filtering-by-process-date @dashboard-requests-filtering-by-process-date","","dashboard-requests-filtering-by-process-date @dashboard-requests-filtering-by-process-date","I am able to filter the dashboard requests by time {""timeInterval"":""1 Hour"",""datetimeFrom"":""1"",""datetimeTo"":""current time""} @success @smoke @TEST-151_time","I am able to filter the dashboard requests by time {""timeInterval"":""1 Hour"",""datetimeFrom"":""1"",""datetimeTo"":""current time""} @success @smoke @TEST-151_time",""
"passed","Tue Nov 24 08:40:08 GMT 2020","Tue Nov 24 08:40:48 GMT 2020","39097","","Content Management Policy Editing @content-management-policy-editing","","Content Management Policy Editing @content-management-policy-editing","A user is able to change all content flags for all file type in policy page {""FileType"":""word"",""FlagType"":""sanitise""} @success @functional @smoke @TEST-215","A user is able to change all content flags for all file type in policy page {""FileType"":""word"",""FlagType"":""sanitise""} @success @functional @smoke @TEST-215",""
"passed","Tue Nov 24 08:39:35 GMT 2020","Tue Nov 24 08:39:48 GMT 2020","13138","","non-compliant-files-routing-mechanism @non-compliant-files-routing-mechanism","","non-compliant-files-routing-mechanism @non-compliant-files-routing-mechanism","I can change the outcome of Glasswall Blocked files {""routeOption"":""Refer"",""updatedRouteOption"":""Refer""} @success @smoke @TEST-187","I can change the outcome of Glasswall Blocked files {""routeOption"":""Refer"",""updatedRouteOption"":""Refer""} @success @smoke @TEST-187",""
"failed","Tue Nov 24 08:38:25 GMT 2020","Tue Nov 24 08:39:02 GMT 2020","36925","","content-management-policy-application-to-files @content-management-policy-application-to-files","","content-management-policy-application-to-files @content-management-policy-application-to-files","Content Management policy is correctly applied to processed files {""contentFlags"":""hyperlink"",""flagType"":""disallow"",""fileType"":""jpg"",""file"":""Complete+works+of+shakespeare+hidden+zip_Polyglot_image.jpg"",""fileOutcome"":""htmlReport""} @smoke @TEST-212 @Fail-code","Content Management policy is correctly applied to processed files {""contentFlags"":""hyperlink"",""flagType"":""disallow"",""fileType"":""jpg"",""file"":""Complete+works+of+shakespeare+hidden+zip_Polyglot_image.jpg"",""fileOutcome"":""htmlReport""} @smoke @TEST-212 @Fail-code",""
"passed","Tue Nov 24 08:37:40 GMT 2020","Tue Nov 24 08:38:08 GMT 2020","27998","","request-history-filtering-by-risk-outcome @request-history-filtering-by-risk-outcome","","request-history-filtering-by-risk-outcome @request-history-filtering-by-risk-outcome","I can filter the log by file risks {""filter"":""Safe"",""filteredFile"":""Safe""} @success @functional @smoke @TEST-164","I can filter the log by file risks {""filter"":""Safe"",""filteredFile"":""Safe""} @success @functional @smoke @TEST-164",""
"failed","Tue Nov 24 08:38:14 GMT 2020","Tue Nov 24 08:38:25 GMT 2020","10829","","dashboard-requests-filtering-by-file-risk @dashboard-requests-filtering-by-file-risk","","dashboard-requests-filtering-by-file-risk @dashboard-requests-filtering-by-file-risk","I can filter the risk legend {""chart"":""pie"",""fileRisk"":""Allowed By NCFS"",""filteredRisk"":""Allowed By NCFS""} @smoke @TEST-192 @Fail-App","I can filter the risk legend {""chart"":""pie"",""fileRisk"":""Allowed By NCFS"",""filteredRisk"":""Allowed By NCFS""} @smoke @TEST-192 @Fail-App",""
"passed","Tue Nov 24 08:39:02 GMT 2020","Tue Nov 24 08:39:24 GMT 2020","22213","","Content Management Policy Editing @content-management-policy-editing","","Content Management Policy Editing @content-management-policy-editing","A user can cancel any updates that they have done to the policy by pressing cancel {""FileType"":""word"",""ContentFlags"":""embeddedFiles"",""CurrentFlagType"":""disallow"",""ChangedFlagType"":""sanitise""} @success @functional @smoke @TEST-213","A user can cancel any updates that they have done to the policy by pressing cancel {""FileType"":""word"",""ContentFlags"":""embeddedFiles"",""CurrentFlagType"":""disallow"",""ChangedFlagType"":""sanitise""} @success @functional @smoke @TEST-213",""
"passed","Tue Nov 24 08:39:22 GMT 2020","Tue Nov 24 08:39:35 GMT 2020","13130","","non-compliant-files-routing-mechanism @non-compliant-files-routing-mechanism","","non-compliant-files-routing-mechanism @non-compliant-files-routing-mechanism","I can change the outcome of Glasswall Blocked files {""routeOption"":""Block"",""updatedRouteOption"":""Block""} @success @smoke @TEST-187","I can change the outcome of Glasswall Blocked files {""routeOption"":""Block"",""updatedRouteOption"":""Block""} @success @smoke @TEST-187",""
"failed","Tue Nov 24 08:38:59 GMT 2020","Tue Nov 24 08:39:10 GMT 2020","10832","","file-drop-file-analysis-reporting @file-drop-file-analysis-reporting","","file-drop-file-analysis-reporting @file-drop-file-analysis-reporting","I can download the full XML analysis report for a file {""supportedFile"":""src/data/input/file1.docx"",""xmlFile"":""file1.xml""} @smoke @TEST-225 @success","I can download the full XML analysis report for a file {""supportedFile"":""src/data/input/file1.docx"",""xmlFile"":""file1.xml""} @smoke @TEST-225 @success",""
"failed","Tue Nov 24 08:37:39 GMT 2020","Tue Nov 24 08:38:25 GMT 2020","45355","","content-management-policy-application-to-files @content-management-policy-application-to-files","","content-management-policy-application-to-files @content-management-policy-application-to-files","Content Management policy is correctly applied to processed files {""contentFlags"":""embeddedFiles"",""flagType"":""sanitise"",""fileType"":""word"",""file"":""MacroRunCalculator.docm"",""fileOutcome"":""Sanitised""} @smoke @TEST-212 @Fail-code","Content Management policy is correctly applied to processed files {""contentFlags"":""embeddedFiles"",""flagType"":""sanitise"",""fileType"":""word"",""file"":""MacroRunCalculator.docm"",""fileOutcome"":""Sanitised""} @smoke @TEST-212 @Fail-code",""
"failed","Tue Nov 24 08:37:39 GMT 2020","Tue Nov 24 08:37:51 GMT 2020","11663","","user-records-admin @user-records-admin","","user-records-admin @user-records-admin","I can add a new user to the ui {""name"":""tester1"",""email"":""tester1@glasswalltest.co""} @smoke @TEST-171 @Fail-app","I can add a new user to the ui {""name"":""tester1"",""email"":""tester1@glasswalltest.co""} @smoke @TEST-171 @Fail-app",""
"failed","Tue Nov 24 08:37:39 GMT 2020","Tue Nov 24 08:37:51 GMT 2020","11790","","file-drop-file-process-result-view @file-drop-file-process-result-view","","file-drop-file-process-result-view @file-drop-file-process-result-view","I can download the full analysis report of a processed file {""supportedFile"":""src/data/input/issues.docx"",""analysisReport"":""issues.docx.xml""} @success @smoke @TEST-227","I can download the full analysis report of a processed file {""supportedFile"":""src/data/input/issues.docx"",""analysisReport"":""issues.docx.xml""} @success @smoke @TEST-227",""
"failed","Tue Nov 24 08:38:15 GMT 2020","Tue Nov 24 08:38:26 GMT 2020","10868","","dashboard-requests-metrics-display @dashboard-requests-metrics-display","","dashboard-requests-metrics-display @dashboard-requests-metrics-display","The count of files requests processed is updated based on processing status {""file"":""safe_file.xlsx"",""fileOutcome"":""Safe"",""TFUpdateByValue"":""1"",""TRUpdateByValue"":""1"",""MFUpdateByValue"":""1""} @smoke @TEST-224","The count of files requests processed is updated based on processing status {""file"":""safe_file.xlsx"",""fileOutcome"":""Safe"",""TFUpdateByValue"":""1"",""TRUpdateByValue"":""1"",""MFUpdateByValue"":""1""} @smoke @TEST-224",""
"passed","Tue Nov 24 08:38:55 GMT 2020","Tue Nov 24 08:39:08 GMT 2020","13131","","non-compliant-files-routing-mechanism @non-compliant-files-routing-mechanism","","non-compliant-files-routing-mechanism @non-compliant-files-routing-mechanism","I can change the outcome of unprocessable files {""routeOption"":""Refer"",""updatedRouteOption"":""Refer""} @success @smoke @TEST-183","I can change the outcome of unprocessable files {""routeOption"":""Refer"",""updatedRouteOption"":""Refer""} @success @smoke @TEST-183",""
"failed","Tue Nov 24 08:38:48 GMT 2020","Tue Nov 24 08:38:59 GMT 2020","10874","","file-drop-file-processing @file-drop-file-processing","","file-drop-file-processing @file-drop-file-processing","An error message is produced when file drop is unable to process a file {""file"":""src/data/input/test2.pdf"",""error"":""This free service is currently limited to a maximum file size of 3.5MB""} @success @smoke @TEST-231","An error message is produced when file drop is unable to process a file {""file"":""src/data/input/test2.pdf"",""error"":""This free service is currently limited to a maximum file size of 3.5MB""} @success @smoke @TEST-231",""
"failed","Tue Nov 24 08:38:04 GMT 2020","Tue Nov 24 08:38:15 GMT 2020","10971","","file-drop-file-process-result-view @file-drop-file-process-result-view","","file-drop-file-process-result-view @file-drop-file-process-result-view","I can see the result of a unrepaired file with the list of structural issues not removed {""fileWithIssues"":""src/data/input/file2.pdf"",""nonrepairedObject"":""Non-conforming image"",""processStatus"":""Your file has been processed""} @success @smoke @TEST-229","I can see the result of a unrepaired file with the list of structural issues not removed {""fileWithIssues"":""src/data/input/file2.pdf"",""nonrepairedObject"":""Non-conforming image"",""processStatus"":""Your file has been processed""} @success @smoke @TEST-229",""
"failed","Tue Nov 24 08:40:02 GMT 2020","Tue Nov 24 08:40:13 GMT 2020","10900","","dashboard-requests-filtering-by-process-date @dashboard-requests-filtering-by-process-date","","dashboard-requests-filtering-by-process-date @dashboard-requests-filtering-by-process-date","I am able to filter the dashboard requests by time {""timeInterval"":""24 Hours"",""datetimeFrom"":""24"",""datetimeTo"":""current time""} @success @smoke @TEST-151_time","I am able to filter the dashboard requests by time {""timeInterval"":""24 Hours"",""datetimeFrom"":""24"",""datetimeTo"":""current time""} @success @smoke @TEST-151_time",""
"failed","Tue Nov 24 08:38:08 GMT 2020","Tue Nov 24 08:38:18 GMT 2020","10846","","request-history-log @request-history-log","","request-history-log @request-history-log","I am able to change the number of files displayed on the page {""itemCount"":""25"",""fileCount"":""4""} @success @smoke @TEST-166","I am able to change the number of files displayed on the page {""itemCount"":""25"",""fileCount"":""4""} @success @smoke @TEST-166",""
"failed","Tue Nov 24 08:37:53 GMT 2020","Tue Nov 24 08:38:04 GMT 2020","11048","","user-records-admin @user-records-admin","","user-records-admin @user-records-admin","I can add a new user to the ui {""name"":""tester2"",""email"":""tester2@glasswalltest.co""} @smoke @TEST-171 @Fail-app","I can add a new user to the ui {""name"":""tester2"",""email"":""tester2@glasswalltest.co""} @smoke @TEST-171 @Fail-app",""
"passed","Tue Nov 24 08:38:14 GMT 2020","Tue Nov 24 08:38:30 GMT 2020","15906","","non-compliant-files-routing-mechanism @non-compliant-files-routing-mechanism","","non-compliant-files-routing-mechanism @non-compliant-files-routing-mechanism","I can only update the non-compliant routes API URL with a valid one {""url"":""invalidurl"",""message"":""error""} @smoke @TEST-158_159 @Fail-app","I can only update the non-compliant routes API URL with a valid one {""url"":""invalidurl"",""message"":""error""} @smoke @TEST-158_159 @Fail-app",""
"passed","Tue Nov 24 08:39:46 GMT 2020","Tue Nov 24 08:40:08 GMT 2020","22154","","Content Management Policy Editing @content-management-policy-editing","","Content Management Policy Editing @content-management-policy-editing","I can edit policy content flags {""FileType"":""excel"",""ContentFlags"":""externalHyperlinks"",""FlagType"":""disallow""} @success @functional @smoke @TEST-214","I can edit policy content flags {""FileType"":""excel"",""ContentFlags"":""externalHyperlinks"",""FlagType"":""disallow""} @success @functional @smoke @TEST-214",""
"passed","Tue Nov 24 08:38:42 GMT 2020","Tue Nov 24 08:39:04 GMT 2020","22093","","content-management-previous-policy @content-management-previous-policy","","content-management-previous-policy @content-management-previous-policy","I can activate a previous policy @success @smoke @TEST-219","I can activate a previous policy @success @smoke @TEST-219",""
"passed","Tue Nov 24 08:38:59 GMT 2020","Tue Nov 24 08:39:12 GMT 2020","13132","","user-session-admin @user-session-admin","","user-session-admin @user-session-admin","I am able to log out of the ui @success @smoke @TEST-","I am able to log out of the ui @success @smoke @TEST-",""
"failed","Tue Nov 24 08:40:09 GMT 2020","Tue Nov 24 08:40:24 GMT 2020","15569","","non-compliant-files-routing-mechanism @non-compliant-files-routing-mechanism","","non-compliant-files-routing-mechanism @non-compliant-files-routing-mechanism","A set routing policy for unprocessable files is correctly applied {""fileTypePolicyAction"":""Relay"",""NcfsDecision"":""NA"",""file"":""src/data/input/file1.docx"",""responseCode"":""204"",""fileOutcome"":""File is clean!""} @success @smoke @TEST-234","A set routing policy for unprocessable files is correctly applied {""fileTypePolicyAction"":""Relay"",""NcfsDecision"":""NA"",""file"":""src/data/input/file1.docx"",""responseCode"":""204"",""fileOutcome"":""File is clean!""} @success @smoke @TEST-234",""
"passed","Tue Nov 24 08:40:25 GMT 2020","Tue Nov 24 08:40:47 GMT 2020","22452","","request-history-file-detail-view @request-history-file-detail-view","","request-history-file-detail-view @request-history-file-detail-view","I am able to view more detail on a file @functional @smoke @TEST-169 @Fail-Code","I am able to view more detail on a file @functional @smoke @TEST-169 @Fail-Code",""
