"Status","Start Time","Stop Time","Duration in ms","Parent Suite","Suite","Sub Suite","Test Class","Test Method","Name","Description"
"passed","Thu Feb 18 13:54:58 GMT 2021","Thu Feb 18 13:55:24 GMT 2021","25137","","content-management-policy-history @content-management-policy-history","","content-management-policy-history @content-management-policy-history","User can change the number of previous polcy records displayed on a page {""itemCount"":""100"",""rowCount"":""100""} @functional @portal @TEST-217","User can change the number of previous polcy records displayed on a page {""itemCount"":""100"",""rowCount"":""100""} @functional @portal @TEST-217",""
"passed","Thu Feb 18 13:53:29 GMT 2021","Thu Feb 18 13:54:09 GMT 2021","40572","","Content Management Policy Editing @content-management-policy-editing","","Content Management Policy Editing @content-management-policy-editing","User can publish a draft Adaptation Policy {""FileType"":""pdf"",""ContentFlag"":""Acroform"",""DraftFlagType"":""disallow"",""CurrentFlagType"":""sanitise""} @portal @functional @TEST-240","User can publish a draft Adaptation Policy {""FileType"":""pdf"",""ContentFlag"":""Acroform"",""DraftFlagType"":""disallow"",""CurrentFlagType"":""sanitise""} @portal @functional @TEST-240",""
"passed","Thu Feb 18 13:56:56 GMT 2021","Thu Feb 18 13:56:58 GMT 2021","2206","","File Processing:","","File Processing:","Supported pdf files process is successful @rtf @fileprocess @functional","Supported pdf files process is successful @rtf @fileprocess @functional",""
"passed","Thu Feb 18 13:56:07 GMT 2021","Thu Feb 18 13:56:49 GMT 2021","41759","","File Processing:","","File Processing:","Supported pdf files process is successful @pdf @fileprocess @functional","Supported pdf files process is successful @pdf @fileprocess @functional",""
"passed","Thu Feb 18 13:52:23 GMT 2021","Thu Feb 18 13:52:54 GMT 2021","30884","","Content Management Policy Editing @content-management-policy-editing","","Content Management Policy Editing @content-management-policy-editing","User can update the current Adaptation policy settings {""FileType"":""excel"",""ContentFlag"":""InternalHyperlinks"",""DraftFlagType"":""sanitise"",""CurrentFlagType"":""disallow""} @portal @functional @TEST-214","User can update the current Adaptation policy settings {""FileType"":""excel"",""ContentFlag"":""InternalHyperlinks"",""DraftFlagType"":""sanitise"",""CurrentFlagType"":""disallow""} @portal @functional @TEST-214",""
"passed","Thu Feb 18 13:53:24 GMT 2021","Thu Feb 18 13:53:56 GMT 2021","31722","","user-records-admin @user-records-admin","","user-records-admin @user-records-admin","A new user cannot be added with a invalid email {""username"":""autotester"",""firstname"":""autotesterfn"",""lastname"":""autotesterln"",""email"":""autotester1@""} @functional @TEST-185 @portal","A new user cannot be added with a invalid email {""username"":""autotester"",""firstname"":""autotesterfn"",""lastname"":""autotesterln"",""email"":""autotester1@""} @functional @TEST-185 @portal",""
"passed","Thu Feb 18 13:51:49 GMT 2021","Thu Feb 18 13:52:58 GMT 2021","68285","","File Processing:","","File Processing:","I process a non supported file using icap client tool @ns @fileprocess @functional","I process a non supported file using icap client tool @ns @fileprocess @functional",""
"failed","Thu Feb 18 13:52:28 GMT 2021","Thu Feb 18 13:52:46 GMT 2021","17974","","request-history-filtering-by-date @request-history-filtering-by-date","","request-history-filtering-by-date @request-history-filtering-by-date","User can filter the request log using a default time interval(1, 12 or 24 hrs) {""timeInterval"":""24 Hours"",""datetimeFrom"":""24"",""datetimeTo"":""current time""} @portal @functional @TEST-167","User can filter the request log using a default time interval(1, 12 or 24 hrs) {""timeInterval"":""24 Hours"",""datetimeFrom"":""24"",""datetimeTo"":""current time""} @portal @functional @TEST-167",""
"passed","Thu Feb 18 13:51:49 GMT 2021","Thu Feb 18 13:52:16 GMT 2021","26500","","content-management-previous-policy @content-management-previous-policy","","content-management-previous-policy @content-management-previous-policy","User can view previous Policy details @portal @functional @TEST-218","User can view previous Policy details @portal @functional @TEST-218",""
"passed","Thu Feb 18 13:55:01 GMT 2021","Thu Feb 18 13:56:31 GMT 2021","89672","","non-compliant-files-routing-mechanism @non-compliant-files-routing-mechanism","","non-compliant-files-routing-mechanism @non-compliant-files-routing-mechanism","A set routing policy for unprocessable files is correctly applied to submitted files {""policyAction"":""relay-glasswallBlockedFiles"",""file"":""structuralIssues.xlsx"",""fileOutcome"":""relayed"",""outcomeValue"":""Allowed by Policy""} @fileprocess @functional @TEST-234","A set routing policy for unprocessable files is correctly applied to submitted files {""policyAction"":""relay-glasswallBlockedFiles"",""file"":""structuralIssues.xlsx"",""fileOutcome"":""relayed"",""outcomeValue"":""Allowed by Policy""} @fileprocess @functional @TEST-234",""
"passed","Thu Feb 18 13:52:58 GMT 2021","Thu Feb 18 13:53:00 GMT 2021","2145","","File Processing:","","File Processing:","Supported office files process is successful @office @fileprocess @functional","Supported office files process is successful @office @fileprocess @functional",""
"passed","Thu Feb 18 13:53:56 GMT 2021","Thu Feb 18 13:54:29 GMT 2021","33108","","user-records-admin @user-records-admin","","user-records-admin @user-records-admin","A duplicate user cannot be added {""username"":""dupautotester"",""firstname"":""dupautotesterfn"",""lastname"":""dupautotesterln"",""email"":""dupautotester1@icaptest.co""} @functional @TEST-186 @portal","A duplicate user cannot be added {""username"":""dupautotester"",""firstname"":""dupautotesterfn"",""lastname"":""dupautotesterln"",""email"":""dupautotester1@icaptest.co""} @functional @TEST-186 @portal",""
"passed","Thu Feb 18 13:51:49 GMT 2021","Thu Feb 18 13:52:55 GMT 2021","65975","","request-history-log @request-history-log","","request-history-log @request-history-log","User can filter the log using file id {""fileId"":""6df836fe-c044-4c01-9470-99211cb79afd"",""datetimeFrom"":""3/02/2021 10:00 AM"",""datetimeTo"":""3/02/2021 16:33 PM""} @portal @functional @TEST-164","User can filter the log using file id {""fileId"":""6df836fe-c044-4c01-9470-99211cb79afd"",""datetimeFrom"":""3/02/2021 10:00 AM"",""datetimeTo"":""3/02/2021 16:33 PM""} @portal @functional @TEST-164",""
"passed","Thu Feb 18 13:54:09 GMT 2021","Thu Feb 18 13:54:33 GMT 2021","23595","","content-management-policy-history @content-management-policy-history","","content-management-policy-history @content-management-policy-history","User can change the number of previous polcy records displayed on a page {""itemCount"":""25"",""rowCount"":""25""} @functional @portal @TEST-217","User can change the number of previous polcy records displayed on a page {""itemCount"":""25"",""rowCount"":""25""} @functional @portal @TEST-217",""
"passed","Thu Feb 18 13:54:33 GMT 2021","Thu Feb 18 13:54:58 GMT 2021","25706","","content-management-policy-history @content-management-policy-history","","content-management-policy-history @content-management-policy-history","User can change the number of previous polcy records displayed on a page {""itemCount"":""50"",""rowCount"":""50""} @functional @portal @TEST-217","User can change the number of previous polcy records displayed on a page {""itemCount"":""50"",""rowCount"":""50""} @functional @portal @TEST-217",""
"passed","Thu Feb 18 13:52:09 GMT 2021","Thu Feb 18 13:52:27 GMT 2021","18000","","user-session-admin @user-session-admin","","user-session-admin @user-session-admin","User can log out of the ui @portal @functional @TEST-236","User can log out of the ui @portal @functional @TEST-236",""
"skipped","Thu Feb 18 13:54:33 GMT 2021","Thu Feb 18 13:54:33 GMT 2021","0","","user-records-admin @user-records-admin","","user-records-admin @user-records-admin","A existing user record can be update {""username"":""usertoupdate"",""firstname"":""fntoupdate"",""lastname"":""lntoupdate"",""email"":""emailtoupdate@glasswalltest.co"",""newfirstname"":""newfname""} @functional @portal @TEST-update","A existing user record can be update {""username"":""usertoupdate"",""firstname"":""fntoupdate"",""lastname"":""lntoupdate"",""email"":""emailtoupdate@glasswalltest.co"",""newfirstname"":""newfname""} @functional @portal @TEST-update",""
"passed","Thu Feb 18 13:52:54 GMT 2021","Thu Feb 18 13:53:28 GMT 2021","34967","","Content Management Policy Editing @content-management-policy-editing","","Content Management Policy Editing @content-management-policy-editing","User can delete a draft policy {""FileType"":""excel"",""ContentFlag"":""ExternalHyperlinks"",""DraftFlagType"":""sanitise"",""CurrentFlagType"":""disallow""} @portal @functional @TEST-239","User can delete a draft policy {""FileType"":""excel"",""ContentFlag"":""ExternalHyperlinks"",""DraftFlagType"":""sanitise"",""CurrentFlagType"":""disallow""} @portal @functional @TEST-239",""
"passed","Thu Feb 18 13:53:14 GMT 2021","Thu Feb 18 13:55:01 GMT 2021","107226","","non-compliant-files-routing-mechanism @non-compliant-files-routing-mechanism","","non-compliant-files-routing-mechanism @non-compliant-files-routing-mechanism","A set routing policy for Glasswall blocked files is correctly applied to submitted files {""policyAction"":""relay-glasswallBlockedFiles"",""fileType"":""word"",""contentFlag"":""InternalHyperlinks"",""flagType"":""disallow"",""file"":""file1.docx"",""fileOutcome"":""relayed"",""outcomeValue"":""Allowed by Policy""} @functional @fileprocess @TEST-233","A set routing policy for Glasswall blocked files is correctly applied to submitted files {""policyAction"":""relay-glasswallBlockedFiles"",""fileType"":""word"",""contentFlag"":""InternalHyperlinks"",""flagType"":""disallow"",""file"":""file1.docx"",""fileOutcome"":""relayed"",""outcomeValue"":""Allowed by Policy""} @functional @fileprocess @TEST-233",""
"failed","Thu Feb 18 13:51:49 GMT 2021","Thu Feb 18 13:52:24 GMT 2021","35126","","non-compliant-files-routing-mechanism @non-compliant-files-routing-mechanism","","non-compliant-files-routing-mechanism @non-compliant-files-routing-mechanism","User can update the non-compliant routes API URL {""url"":""icap-client-qa.uksouth.cloudapp.azure.com""} @portal @functional @TEST-158","User can update the non-compliant routes API URL {""url"":""icap-client-qa.uksouth.cloudapp.azure.com""} @portal @functional @TEST-158",""
"passed","Thu Feb 18 13:57:09 GMT 2021","Thu Feb 18 13:58:02 GMT 2021","53892","","request-history-filtering-by-risk-outcome @request-history-filtering-by-risk-outcome","","request-history-filtering-by-risk-outcome @request-history-filtering-by-risk-outcome","User can filter the log by file risks {""filter"":""Safe"",""filteredFile"":""Safe""} @portal @functional @TEST-163","User can filter the log by file risks {""filter"":""Safe"",""filteredFile"":""Safe""} @portal @functional @TEST-163",""
"failed","Thu Feb 18 13:52:08 GMT 2021","Thu Feb 18 13:52:28 GMT 2021","19483","","request-history-filtering-by-date @request-history-filtering-by-date","","request-history-filtering-by-date @request-history-filtering-by-date","User can filter the request log using a default time interval(1, 12 or 24 hrs) {""timeInterval"":""12 Hours"",""datetimeFrom"":""12"",""datetimeTo"":""current time""} @portal @functional @TEST-167","User can filter the request log using a default time interval(1, 12 or 24 hrs) {""timeInterval"":""12 Hours"",""datetimeFrom"":""12"",""datetimeTo"":""current time""} @portal @functional @TEST-167",""
"passed","Thu Feb 18 13:53:29 GMT 2021","Thu Feb 18 13:55:47 GMT 2021","138000","","File Processing:","","File Processing:","Supported image files process is successful @images @fileprocess @functional","Supported image files process is successful @images @fileprocess @functional",""
"passed","Thu Feb 18 13:52:47 GMT 2021","Thu Feb 18 13:53:38 GMT 2021","51534","","request-history-filtering-by-file-type @request-history-filtering-by-file-type","","request-history-filtering-by-file-type @request-history-filtering-by-file-type","User can filter the log by file type {""filter"":""xlsx"",""filteredFile"":""Xlsx""} @portal @functional @TEST-180","User can filter the log by file type {""filter"":""xlsx"",""filteredFile"":""Xlsx""} @portal @functional @TEST-180",""
"failed","Thu Feb 18 13:51:49 GMT 2021","Thu Feb 18 13:52:08 GMT 2021","18854","","request-history-filtering-by-date @request-history-filtering-by-date","","request-history-filtering-by-date @request-history-filtering-by-date","User can filter the request log using a default time interval(1, 12 or 24 hrs) {""timeInterval"":""1 Hour"",""datetimeFrom"":""1"",""datetimeTo"":""current time""} @portal @functional @TEST-167","User can filter the request log using a default time interval(1, 12 or 24 hrs) {""timeInterval"":""1 Hour"",""datetimeFrom"":""1"",""datetimeTo"":""current time""} @portal @functional @TEST-167",""
"failed","Thu Feb 18 13:52:46 GMT 2021","Thu Feb 18 13:53:05 GMT 2021","18560","","request-history-filtering-by-date @request-history-filtering-by-date","","request-history-filtering-by-date @request-history-filtering-by-date","User can filter the request log using a custom range and see all transactions within that range {""datetimeFrom"":""11/02/2021 10:00 AM"",""datetimeTo"":""12/02/2021 10:00 AM""} @portal @functional @TEST-235","User can filter the request log using a custom range and see all transactions within that range {""datetimeFrom"":""11/02/2021 10:00 AM"",""datetimeTo"":""12/02/2021 10:00 AM""} @portal @functional @TEST-235",""
"passed","Thu Feb 18 13:55:25 GMT 2021","Thu Feb 18 13:56:17 GMT 2021","51894","","request-history-filtering-by-file-type @request-history-filtering-by-file-type","","request-history-filtering-by-file-type @request-history-filtering-by-file-type","User can filter the log by file type {""filter"":""rtf"",""filteredFile"":""Rtf""} @portal @functional @TEST-180","User can filter the log by file type {""filter"":""rtf"",""filteredFile"":""Rtf""} @portal @functional @TEST-180",""
"failed","Thu Feb 18 13:52:16 GMT 2021","Thu Feb 18 13:53:17 GMT 2021","61449","","content-management-previous-policy @content-management-previous-policy","","content-management-previous-policy @content-management-previous-policy","User can activate a previous policy @portal @functional @TEST-219","User can activate a previous policy @portal @functional @TEST-219",""
"passed","Thu Feb 18 13:53:38 GMT 2021","Thu Feb 18 13:54:33 GMT 2021","54738","","request-history-filtering-by-file-type @request-history-filtering-by-file-type","","request-history-filtering-by-file-type @request-history-filtering-by-file-type","User can filter the log by file type {""filter"":""pptx"",""filteredFile"":""Pptx""} @portal @functional @TEST-180","User can filter the log by file type {""filter"":""pptx"",""filteredFile"":""Pptx""} @portal @functional @TEST-180",""
"passed","Thu Feb 18 13:56:17 GMT 2021","Thu Feb 18 13:57:08 GMT 2021","51799","","request-history-filtering-by-file-type @request-history-filtering-by-file-type","","request-history-filtering-by-file-type @request-history-filtering-by-file-type","User can filter the log by file type {""filter"":""png"",""filteredFile"":""Png""} @portal @functional @TEST-180","User can filter the log by file type {""filter"":""png"",""filteredFile"":""Png""} @portal @functional @TEST-180",""
"passed","Thu Feb 18 13:52:55 GMT 2021","Thu Feb 18 13:53:24 GMT 2021","28609","","user-records-admin @user-records-admin","","user-records-admin @user-records-admin","I can add a new user to the ui {""username"":""tester1"",""firstname"":""autotestfn"",""lastname"":""autotestln"",""email"":""tester1@glasswalltest.co""} @functional @TEST-171 @portal","I can add a new user to the ui {""username"":""tester1"",""firstname"":""autotestfn"",""lastname"":""autotestln"",""email"":""tester1@glasswalltest.co""} @functional @TEST-171 @portal",""
"passed","Thu Feb 18 13:51:49 GMT 2021","Thu Feb 18 13:52:47 GMT 2021","57189","","request-history-filtering-by-file-type @request-history-filtering-by-file-type","","request-history-filtering-by-file-type @request-history-filtering-by-file-type","User can filter the log by file type {""filter"":""docx"",""filteredFile"":""Docx""} @portal @functional @TEST-180","User can filter the log by file type {""filter"":""docx"",""filteredFile"":""Docx""} @portal @functional @TEST-180",""
"passed","Thu Feb 18 13:51:49 GMT 2021","Thu Feb 18 13:52:23 GMT 2021","33358","","Content Management Policy Editing @content-management-policy-editing","","Content Management Policy Editing @content-management-policy-editing","User can cancel a draft policy creation {""FileType"":""powerpoint"",""ContentFlag"":""Metadata"",""DraftFlagType"":""disallow"",""CurrentFlagType"":""sanitise""} @portal @functional @TEST-213","User can cancel a draft policy creation {""FileType"":""powerpoint"",""ContentFlag"":""Metadata"",""DraftFlagType"":""disallow"",""CurrentFlagType"":""sanitise""} @portal @functional @TEST-213",""
"passed","Thu Feb 18 13:52:54 GMT 2021","Thu Feb 18 13:53:14 GMT 2021","19985","","non-compliant-files-routing-mechanism @non-compliant-files-routing-mechanism","","non-compliant-files-routing-mechanism @non-compliant-files-routing-mechanism","User can change the outcome of Glasswall Blocked files {""routeOption"":""block-glasswallBlockedFiles"",""updatedRouteOption"":""Block""} @portal @functional @TEST-187","User can change the outcome of Glasswall Blocked files {""routeOption"":""block-glasswallBlockedFiles"",""updatedRouteOption"":""Block""} @portal @functional @TEST-187",""
"failed","Thu Feb 18 13:53:05 GMT 2021","Thu Feb 18 13:53:23 GMT 2021","18251","","request-history-filtering-by-date @request-history-filtering-by-date","","request-history-filtering-by-date @request-history-filtering-by-date","User cannot filter the date range to a time greater than 24 hours {""datetimeFrom"":""20/10/2020 0:45 AM"",""datetimeTo"":""26/10/2020 13:45 PM""} @portal @functional @TEST-184","User cannot filter the date range to a time greater than 24 hours {""datetimeFrom"":""20/10/2020 0:45 AM"",""datetimeTo"":""26/10/2020 13:45 PM""} @portal @functional @TEST-184",""
"passed","Thu Feb 18 13:52:25 GMT 2021","Thu Feb 18 13:52:54 GMT 2021","29078","","non-compliant-files-routing-mechanism @non-compliant-files-routing-mechanism","","non-compliant-files-routing-mechanism @non-compliant-files-routing-mechanism","User can change the outcome of unprocessable files {""routeOption"":""relay-unprocessableFileTypes"",""updatedRouteOption"":""Relay""} @portal @functional @TEST-183","User can change the outcome of unprocessable files {""routeOption"":""relay-unprocessableFileTypes"",""updatedRouteOption"":""Relay""} @portal @functional @TEST-183",""
"failed","Thu Feb 18 13:54:33 GMT 2021","Thu Feb 18 13:54:33 GMT 2021","8","","user-records-admin @user-records-admin","","user-records-admin @user-records-admin","I can delete another user from the page {""email"":""recordtodelete@glasswalltest.co""} @functional @TEST-172 @portal","I can delete another user from the page {""email"":""recordtodelete@glasswalltest.co""} @functional @TEST-172 @portal",""
"passed","Thu Feb 18 13:57:04 GMT 2021","Thu Feb 18 13:57:06 GMT 2021","2130","","File Processing:","","File Processing:","Supported archive files process is successful @archives @fileprocess @functional","Supported archive files process is successful @archives @fileprocess @functional",""
"passed","Thu Feb 18 13:51:49 GMT 2021","Thu Feb 18 13:52:09 GMT 2021","19990","","user-session-admin @user-session-admin","","user-session-admin @user-session-admin","User can log into the ui @portal @functional @TEST-login","User can log into the ui @portal @functional @TEST-login",""
"passed","Thu Feb 18 13:54:33 GMT 2021","Thu Feb 18 13:55:25 GMT 2021","51798","","request-history-filtering-by-file-type @request-history-filtering-by-file-type","","request-history-filtering-by-file-type @request-history-filtering-by-file-type","User can filter the log by file type {""filter"":""pdf"",""filteredFile"":""Pdf""} @portal @functional @TEST-180","User can filter the log by file type {""filter"":""pdf"",""filteredFile"":""Pdf""} @portal @functional @TEST-180",""
